{
  "visual_metadata": [
    {"team_id": "nba-ATL", "abbreviation": "ATL", "accent_color": "#C8102E", "secondary_accent_color": "#FDB927", "badge_style": "abbreviation_badge", "source_name": "manual non-official UI accent palette", "as_of_date": "2026-06-25", "manual_review_required": true, "no_official_branding": true},
    {"team_id": "nba-BOS", "abbreviation": "BOS", "accent_color": "#007A33", "secondary_accent_color": "#A8ADAA", "badge_style": "abbreviation_badge", "source_name": "manual non-official UI accent palette", "as_of_date": "2026-06-25", "manual_review_required": true, "no_official_branding": true},
    {"team_id": "nba-BKN", "abbreviation": "BKN", "accent_color": "#000000", "secondary_accent_color": "#777777", "badge_style": "abbreviation_badge", "source_name": "manual non-official UI accent palette", "as_of_date": "2026-06-25", "manual_review_required": true, "no_official_branding": true},
    {"team_id": "nba-CHA", "abbreviation": "CHA", "accent_color": "#1D1160", "secondary_accent_color": "#00788C", "badge_style": "abbreviation_badge", "source_name": "manual non-official UI accent palette", "as_of_date": "2026-06-25", "manual_review_required": true, "no_official_branding": true},
    {"team_id": "nba-CHI", "abbreviation": "CHI", "accent_color": "#B22222", "secondary_accent_color": "#111111", "badge_style": "abbreviation_badge", "source_name": "manual non-official UI accent palette", "as_of_date": "2026-06-25", "manual_review_required": true, "no_official_branding": true},
    {"team_id": "nba-CLE", "abbreviation": "CLE", "accent_color": "#6F0023", "secondary_accent_color": "#E0A820", "badge_style": "abbreviation_badge", "source_name": "manual non-official UI accent palette", "as_of_date": "2026-06-25", "manual_review_required": true, "no_official_branding": true},
    {"team_id": "nba-DAL", "abbreviation": "DAL", "accent_color": "#005085", "secondary_accent_color": "#002B5C", "badge_style": "abbreviation_badge", "source_name": "manual non-official UI accent palette", "as_of_date": "2026-06-25", "manual_review_required": true, "no_official_branding": true},
    {"team_id": "nba-DEN", "abbreviation": "DEN", "accent_color": "#0E2240", "secondary_accent_color": "#F5B223", "badge_style": "abbreviation_badge", "source_name": "manual non-official UI accent palette", "as_of_date": "2026-06-25", "manual_review_required": true, "no_official_branding": true},
    {"team_id": "nba-DET", "abbreviation": "DET", "accent_color": "#003DA5", "secondary_accent_color": "#D4001F", "badge_style": "abbreviation_badge", "source_name": "manual non-official UI accent palette", "as_of_date": "2026-06-25", "manual_review_required": true, "no_official_branding": true},
    {"team_id": "nba-GSW", "abbreviation": "GSW", "accent_color": "#1D428A", "secondary_accent_color": "#FDB927", "badge_style": "abbreviation_badge", "source_name": "manual non-official UI accent palette", "as_of_date": "2026-06-25", "manual_review_required": true, "no_official_branding": true},
    {"team_id": "nba-HOU", "abbreviation": "HOU", "accent_color": "#BA0C2F", "secondary_accent_color": "#111111", "badge_style": "abbreviation_badge", "source_name": "manual non-official UI accent palette", "as_of_date": "2026-06-25", "manual_review_required": true, "no_official_branding": true},
    {"team_id": "nba-IND", "abbreviation": "IND", "accent_color": "#002D62", "secondary_accent_color": "#F5B223", "badge_style": "abbreviation_badge", "source_name": "manual non-official UI accent palette", "as_of_date": "2026-06-25", "manual_review_required": true, "no_official_branding": true},
    {"team_id": "nba-LAC", "abbreviation": "LAC", "accent_color": "#003DA5", "secondary_accent_color": "#E03A3E", "badge_style": "abbreviation_badge", "source_name": "manual non-official UI accent palette", "as_of_date": "2026-06-25", "manual_review_required": true, "no_official_branding": true},
    {"team_id": "nba-LAL", "abbreviation": "LAL", "accent_color": "#552583", "secondary_accent_color": "#FDB927", "badge_style": "abbreviation_badge", "source_name": "manual non-official UI accent palette", "as_of_date": "2026-06-25", "manual_review_required": true, "no_official_branding": true},
    {"team_id": "nba-MEM", "abbreviation": "MEM", "accent_color": "#5D76A9", "secondary_accent_color": "#BED4E9", "badge_style": "abbreviation_badge", "source_name": "manual non-official UI accent palette", "as_of_date": "2026-06-25", "manual_review_required": true, "no_official_branding": true},
    {"team_id": "nba-MIA", "abbreviation": "MIA", "accent_color": "#98002E", "secondary_accent_color": "#111111", "badge_style": "abbreviation_badge", "source_name": "manual non-official UI accent palette", "as_of_date": "2026-06-25", "manual_review_required": true, "no_official_branding": true},
    {"team_id": "nba-MIL", "abbreviation": "MIL", "accent_color": "#00471B", "secondary_accent_color": "#EFE1B5", "badge_style": "abbreviation_badge", "source_name": "manual non-official UI accent palette", "as_of_date": "2026-06-25", "manual_review_required": true, "no_official_branding": true},
    {"team_id": "nba-MIN", "abbreviation": "MIN", "accent_color": "#0C2340", "secondary_accent_color": "#236192", "badge_style": "abbreviation_badge", "source_name": "manual non-official UI accent palette", "as_of_date": "2026-06-25", "manual_review_required": true, "no_official_branding": true},
    {"team_id": "nba-NOP", "abbreviation": "NOP", "accent_color": "#0C2340", "secondary_accent_color": "#B4975A", "badge_style": "abbreviation_badge", "source_name": "manual non-official UI accent palette", "as_of_date": "2026-06-25", "manual_review_required": true, "no_official_branding": true},
    {"team_id": "nba-NYK", "abbreviation": "NYK", "accent_color": "#006BB6", "secondary_accent_color": "#F58426", "badge_style": "abbreviation_badge", "source_name": "manual non-official UI accent palette", "as_of_date": "2026-06-25", "manual_review_required": true, "no_official_branding": true},
    {"team_id": "nba-OKC", "abbreviation": "OKC", "accent_color": "#007AC1", "secondary_accent_color": "#EF3B24", "badge_style": "abbreviation_badge", "source_name": "manual non-official UI accent palette", "as_of_date": "2026-06-25", "manual_review_required": true, "no_official_branding": true},
    {"team_id": "nba-ORL", "abbreviation": "ORL", "accent_color": "#0077C0", "secondary_accent_color": "#C4CED4", "badge_style": "abbreviation_badge", "source_name": "manual non-official UI accent palette", "as_of_date": "2026-06-25", "manual_review_required": true, "no_official_branding": true},
    {"team_id": "nba-PHI", "abbreviation": "PHI", "accent_color": "#006BB6", "secondary_accent_color": "#ED174C", "badge_style": "abbreviation_badge", "source_name": "manual non-official UI accent palette", "as_of_date": "2026-06-25", "manual_review_required": true, "no_official_branding": true},
    {"team_id": "nba-PHX", "abbreviation": "PHX", "accent_color": "#1D1160", "secondary_accent_color": "#E56020", "badge_style": "abbreviation_badge", "source_name": "manual non-official UI accent palette", "as_of_date": "2026-06-25", "manual_review_required": true, "no_official_branding": true},
    {"team_id": "nba-POR", "abbreviation": "POR", "accent_color": "#C8102E", "secondary_accent_color": "#111111", "badge_style": "abbreviation_badge", "source_name": "manual non-official UI accent palette", "as_of_date": "2026-06-25", "manual_review_required": true, "no_official_branding": true},
    {"team_id": "nba-SAC", "abbreviation": "SAC", "accent_color": "#5A2D81", "secondary_accent_color": "#637270", "badge_style": "abbreviation_badge", "source_name": "manual non-official UI accent palette", "as_of_date": "2026-06-25", "manual_review_required": true, "no_official_branding": true},
    {"team_id": "nba-SAS", "abbreviation": "SAS", "accent_color": "#111111", "secondary_accent_color": "#C4CED4", "badge_style": "abbreviation_badge", "source_name": "manual non-official UI accent palette", "as_of_date": "2026-06-25", "manual_review_required": true, "no_official_branding": true},
    {"team_id": "nba-TOR", "abbreviation": "TOR", "accent_color": "#B22222", "secondary_accent_color": "#111111", "badge_style": "abbreviation_badge", "source_name": "manual non-official UI accent palette", "as_of_date": "2026-06-25", "manual_review_required": true, "no_official_branding": true},
    {"team_id": "nba-UTA", "abbreviation": "UTA", "accent_color": "#002B5C", "secondary_accent_color": "#F9A01B", "badge_style": "abbreviation_badge", "source_name": "manual non-official UI accent palette", "as_of_date": "2026-06-25", "manual_review_required": true, "no_official_branding": true},
    {"team_id": "nba-WAS", "abbreviation": "WAS", "accent_color": "#002B5C", "secondary_accent_color": "#E31837", "badge_style": "abbreviation_badge", "source_name": "manual non-official UI accent palette", "as_of_date": "2026-06-25", "manual_review_required": true, "no_official_branding": true}
  ],
  "source_name": "manual non-official UI accent palette",
  "as_of_date": "2026-06-25",
  "manual_review_required": true,
  "no_official_branding": true
}
